{
    "$schema": "http://json-schema.org/draft-07/schema#",
    "type": "object",
    "properties": {
        "name": {
            "type": "string",
            "minLength": 1,
            "description": "The name of the portable project."
        },
        "version": {
            "type": "string",
            "pattern": "^\\d+\\.\\d+\\.\\d+$",
            "description": "The version of the portable project (semantic versioning)."
        },
        "description": {
            "type": "string",
            "minLength": 1,
            "description": "A short description of the project."
        },
        "binaries": {
            "type": "array",
            "minItems": 1,
            "items": {
                "type": "object",
                "properties": {
                    "path": {
                        "type": "string",
                        "minLength": 1,
                        "description": "Path to the binary file."
                    }
                },
                "required": ["path"]
            },
            "description": "An array of binaries required for the portable image."
        },
        "unit_files": {
            "type": "array",
            "minItems": 1,
            "items": {
                "type": "object",
                "properties": {
                    "path": {
                        "type": "string",
                        "minLength": 1,
                        "description": "Path to the systemd unit file."
                    },
                    "type": {
                        "type": "string",
                        "enum": ["service", "socket", "timer"],
                        "description": "Type of the unit file (service, socket, or timer)."
                    }
                },
                "required": ["path", "type"]
            },
            "description": "An array of systemd unit files required for the portable image."
        }
    },
    "required": ["name", "version", "binaries", "unit_files"]
}

